{
  "$schema": "../../schemas/cms-update.schema.json",
  "schemaVersion": 2,
  "product": "cubedonate-cms",
  "channel": "stable",
  "version": "2.55.0",
  "tag": "v2.55.0",
  "publishedAt": "2026-08-28T20:26:35Z",
  "minimumVersion": "2.54.1",
  "required": false,
  "releaseUrl": "https://github.com/OzyrusDev/cubedonate/releases/tag/v2.55.0",
  "releaseNotes": {
    "ru": "https://github.com/OzyrusDev/cubedonate/blob/v2.55.0/docs/ru_updates/UPDATE-2.55.md",
    "en": "https://github.com/OzyrusDev/cubedonate/blob/v2.55.0/docs/en_updates/UPDATE-2.55.md"
  },
  "download": {
    "access": "private",
    "repository": "OzyrusDev/cubedonate",
    "assetName": null
  },
  "sourceCommit": "1f4e55c5e3a0e28c7d0907e9d2d841683d8e068e",
  "sha256": "f1802c7cfda3c486eca6eee09f991ea7bfb487102763b38e220f509eb7703ac2",
  "signature": "1ZKGIBxreendKoPGZzyAVj9KpqHacUPbgGuaUuiBr6VJiIjvwRLDUzt/L3ahXq9dpA3yphInU/8UNsVzAzghDA=="
}
